<?xml version="1.0" encoding="UTF-8"?>
<!--
To change this license header, choose License Headers in Project Properties.
To change this template file, choose Tools | Templates
and open the template in the editor.
-->

<!DOCTYPE attractions SYSTEM 'attractions.dtd'>

<attractions>
    <city>Zurich, Switzerland</city>
    
    <!-- Define the categories of the website -->
    <categories>
        <category code="eat">Eat</category>
        <category code="sleep">Sleep</category>
        <category code="play">Play</category>
    </categories>
    
    <category code="eat">
        <attraction name="" />
    </category>
    
    <category code="sleep">
        
    </category>
    
    <category code="play>
    </category>
</attractions>
